{
  "version": 1,
  "skill": "auditing-section-1983-discovery-responses",
  "input_roles": ["served-discovery", "responses", "production", "authorities"],
  "target": {
    "policy": "required",
    "roles": ["served-discovery", "responses"]
  },
  "internet": "disabled",
  "output": { "mode": "append-immutable" }
}
